name,image,ingredients,calories,fat,carbs,protein
Lemon Brioche French Toast & Raspberries,https://www.edamam.com/web-img/8a3/8a3b1ebc4842e44e95189c023f5f4b12.jpg,"For the baked French toast|One 16 to 20-ounce loaf brioche, challah, or other egg-enriched bread|2 lemons, zested and juiced|3 large eggs|1/4 cup brown sugar|3 cups 2% milk|1 teaspoon vanilla extract|1/4 teaspoon salt|1/2 teaspoon ground nutmeg|1 1/2 cups confectioners' sugar, plus more for dusting|For the minted raspberries|12 ounces red raspberries, lightly washed and picked over|1/4 cup dry cava wine|1/4 cup loosely-packed mint leaves",306.83421056875,4.8419674690250005,55.579565316399986,10.395925115200003
French Toast Bagels,https://www.edamam.com/web-img/ed5/ed590b7431124b0f8169442268759bc5.jpg,"4 small-to-medium sized bagels, preferably stale (approximately 3.5 ounces per bagel)|4 large eggs|1/2 cup skim or 2 percent milk|1 tablespoon butter or oil|Maple syrup, honey, butter, jam, or cream cheese for serv1 tablespoon butter or oil for greasing the pan, if ing",386.56350000000003,9.548105,57.03433,17.773075
Broiled French Toast,https://www.edamam.com/web-img/f6e/f6ea3c9ce161c4f80383ea626173c37f.jpg,"Roughly 6 slices of bread, depending on size of slice|1 tsp (5g) or less butter|2 eggs|⅔ cup (158ml) milk|½ tsp (2,5g) vanilla|½ tsp (1,5g) cinnamon",183.42859074852768,5.796916925126474,23.668022304802175,8.67279198127643
Pear and Bacon Whole-Grain French Toast,https://www.edamam.com/web-img/9b0/9b09816ee188edbc94691a9fd5b69ff8.jpg,The Upgrade:|2 slices whole-grain French toast|1 slice cooked and crumbled center-cut bacon|1/4 cup thinly sliced pear|1 tablespoon shaved Parmesan cheese,447.80559999999997,22.419793999999996,44.036296,17.58715
Fried Calamari recipes,https://www.edamam.com/web-img/006/0062c5291dd1040c03536ffd15b3fdbc,"1 1/2 pounds cleaned calamari, bodies cut into 1/2-inch rings and tentacles left whole|1 1/2 pounds cleaned calamari, bodies cut into 1/2-inch rings and tentacles left whole|2 cups well-shaken buttermilk|3 cups all-purpose flour|2 tablespoons kosher salt|canola oil|1 lemon, cut into 8 wedges",842.3775912941925,53.41072008827515,50.99300499828571,38.22908196257142
Dry Fried Calamari,https://www.edamam.com/web-img/a3e/a3e634de0c446f60f611e69b0e6f5080.jpg,"2 quarts peanut oil (you just need enough to cover the calamari)|1 pound squid, tubes and tentacles|1/2 cup all-purpose flour|1/2 cup plain cornmeal|Kosher salt|Freshly ground black pepper",442.22285022742,25.1993323598215,32.12213461446125,20.857810821932254
Fried Calamari,https://www.edamam.com/web-img/eff/eff09ad936d414a6de1412c13acfbd92.JPG,"4 cups vegetable oil, or less if you are pan frying|1 pound cleaned small calamari (squid), tubes and legs, rinsed well and drained|1 cup all-purpose flour|1 cup masa harina, or fine corn meal|1 handful parsley leaves, for garnish (optional)|1 large meyer lemon, or regular lemon, sliced into thin rounds (optional)|1 tablespoon minced parsley, for garnish (optional)|Kosher salt|Lemon wedges|Sriracha mayo (2 tablespoons mayo mixed with sriracha hot sauce to taste)",797.3106672993717,30.544742499933108,111.49332499999166,17.07817999999757
Fried Calamari Sandwich,https://www.edamam.com/web-img/b79/b7950289b7820c55e9d7ccca135b24df.jpg,"½ cup mayonnaise|1 tbsp. sriracha hot sauce|1 tsp. crushed red chile flakes|1 tbsp. canola oil, plus more for frying|2 cloves garlic, thinly sliced 2 tsp. fish sauce|6 dried chiles de árbol, stemmed, seeded, soaked overnight, and drained|1 lb. calamari rings and tentacles, cleaned|2 cups cornmeal|2 6″ soft hoagie rolls|6 leaves basil|4 sprigs cilantro|¼ cucumber, thinly sliced lengthwise|¼ small bulb fennel, thinly sliced lengthwise|1 lime, peeled and segmented",1393.1515874221698,59.44742596410935,160.17155360910277,51.15209478966424
Tempura Fried Calamari,https://www.edamam.com/web-img/c62/c626982b49ac75890ad9d21f33e7fa22.jpg,1 pound cleaned squid|1 egg yolk|1 cup ice cold sparkling water (the colder the better)|1/8 teaspoon baking soda|1 teaspoon salt|1/4 cup corn starch|3/4 cup rice or regular flour|Canola oil or peanut oil for frying (high smoke point vegetable oil)|A deep fryer,914.2337799477779,70.0920805898889,26.61587472155556,42.279304929888895
Bok Choy and Kale Fried Rice With Fried Garlic Recipe,https://www.edamam.com/web-img/69f/69f0b31129d50673961588f6b1839fe7.jpg,"For the Fried Garlic:|1 whole head of garlic, peeled|Kosher salt|1/4 cup vegetable oil|For the Fried Rice:|3 cups day-old cooked jasmine or short grain rice (see note above)|2 cups chopped kale (about 4 ounces)|2 cups chopped bok choy (about 4 ounces)|1 Thai bird's eye chili, finely minced|1/4 teaspoon ground white pepper|1 teaspoon soy sauce",692.9584400333424,15.291332111549197,124.72288537037501,12.349508867250004
Asian Chicken and Fried Rice,https://www.edamam.com/web-img/8a9/8a976e0e97a6ecde02258eb052f9021c.jpg,1   (8.8-oz.) pouch ready-to-serve Asian fried rice|2 cups  shredded cooked chicken|1 tablespoon  chopped fresh basil|2 tablespoons  fresh lemon juice,343.1206030165182,5.023779922915502,49.98408294675153,21.674956492192184
Kimchi Fried Rice,https://www.edamam.com/web-img/a9b/a9bd45c52954e76d510b281aede08ba1.jpg,"170 grams kimchi (3/4 cup packed), chopped|1/3 cup kimchi juice|1 tablespoon gochujang|1/2 tablespoon soy sauce|2 teaspoons toasted sesame oil|560 grams rice – cooked short grain about 3 cups|1 tablespoon vegetable oil|1 scallion finely chopped|2 eggs - sunnyside up",1225.771562499711,17.87683437499127,231.72106562496157,27.13625937498302
Vegetable Fried Rice,https://www.edamam.com/web-img/b9b/b9b7b18b0a3a033492c8ec606b9c7bbb.jpg,"3 tbsp. vegetable oil, divided|2 eggs|½ cup (100g) chopped onion|1 cup (200g) mixed chopped vegetables (such as peppers, mushrooms, green onions)|1 garlic clove, minced|4 tbsp. soy sauce|2 cups (350g) cooked white or brown rice, cooled to room temperature",991.825,30.539200000000005,153.8206,25.106
Eggy Fried Rice,https://www.edamam.com/web-img/41d/41d37819b3cd49774b0728ad7ea2dbcc.jpg,"2 large spring onions , finely sliced|1.0 tbsp soy sauce|2 eggs|85.0g carrots , diced|25.0g butter|85.0g frozen peas|1.0 tbsp vegetable oil|200.0g basmati rice (or use cooked rice)",213.46166666666667,7.417716666666667,30.7855,5.453166666666667
Macaroon and Frozen Yogurt Sandwich,https://www.edamam.com/web-img/2bf/2bfcbc7fccaa5dd70f3ef9c7473f0d1c.jpg,"20 almond macaroons almond macaroons|About 2 1/2 cups frozen yogurt frozen yogurt|Coarsely chopped toasted almonds, for garnish",48.402499999999996,2.531825,4.32353,2.1978549999999997
Cherry Frozen Yogurt,https://www.edamam.com/web-img/fdc/fdcc92cb816d63367e02d75db37eb679.jpg,"3 cups pitted fresh cherries|2 Tbsp lemon juice|3/4 cup sugar (more or less depending on how sweet the cherries and how sweet you want your frozen yogurt to be)|1/4 cup whole milk (can substitute half-and-half or cream for creamier version)|1 1/2 cups full fat yogurt (if you are using non or low-fat yogurt, add 2 Tbsp heavy cream)|2 Tbsp almond liqueuer such as Amaretto (optional)",170.47312499999998,6.44208125,24.1257875,6.3513937500000015
Mango Frozen Yogurt,https://www.edamam.com/web-img/d28/d2831bd1830af77c54199cdc36ad3457.jpg,16 to 24 ounces mango (3 smallish mangoes or 1 package frozen mango chunks)|1/3 cup (3 ounces) vanilla yogurt|1 tablespoon honey,238.162780734375,1.6088354373437501,56.98793692812501,4.452608131343751
Mango Frozen Yogurt,https://www.edamam.com/web-img/10a/10a6ac5873513ede0ce252839bd3b4db.jpg,1 cup diced frozen mango|1/3 cup yogurt|2 tbs superfine sugar|1 tbs lemon or lime juice,67.19166666665038,0.8229866666666211,14.953336666661185,1.06287833333306
Bumbleberry Frozen Yogurt,https://www.edamam.com/web-img/5b0/5b0f20c32e4afd6736602e8d91228cc0.jpg,"2 cup fresh mixed berries|2/3 cup granulated sugar|1 tbsp freshly-squeezed lemon juice|2 cup Greek yogurt, or well-drained whole milk yogurt",241.185,3.9413500000000004,49.57986666666667,4.4983
Garlic Bread,https://www.edamam.com/web-img/e07/e07e40b081db24b2e9f641a94c9fecf8.jpg,"4 garlic cloves|Coarse salt and ground pepper|4 tablespoons (1/2 stick) butter, melted|1 baguette (24 inches long), halved crosswise, then lengthwise",155.48913299999998,6.678318579999999,20.043602850000003,4.20136937
Garlic Bread,https://www.edamam.com/web-img/6e7/6e7e997bc716cef5636b990fcc9315e8.jpg,"1 16-ounce loaf of Italian bread or French bread|1/2 cup (1 stick) unsalted butter, softened|2 large cloves of garlic, smashed and minced|1 heaping tablespoon of freshly chopped parsley|1/4 cup freshly grated Parmesan cheese (optional)",257.4122903375,13.501950368749998,28.801353125000006,5.203717320000002
Garlic Bread,https://www.edamam.com/web-img/9c2/9c2491564488ad391520b60ddbc7b2a7.jpg,"2 large garlic cloves, finely chopped|1/2 stick (1/4 cup) unsalted butter, well softened|1 tablespoon extra-virgin olive oil|2 tablespoons finely chopped flat-leaf parsley|1 (15"") loaf Italian bread (about 3 1/2"" wide)|4 tablespoons grated Parmesan",272.2359833333333,14.24845683333333,27.607919,8.296915833333335
Lentil Soup With Garlic Bread,https://www.edamam.com/web-img/254/25492d9b0f17110b1daba0a1e04d61a0.jpg,FOR THE GARLIC BREAD|0.5 small celeriac|2 tsp marjoram|Several slices of mild cheddar cheese (enough to cover the surface of the rolls cut open)|3-4 garlic cloves pressed|2 l vegetable stock|2 medium onions|2 garlic cloves thinly sliced|1 parsnip|3 carrots|2 semi-baked pettit pains (57g)|FOR THE SOUP|3 tbsp olive oil|350 ml green lentils|Chopped parsley for garnish|Salt and pepper to taste|Butter or spread|2 tbsp tomato puree,461.55613622860443,21.83972931389367,49.320555690449595,19.994331093550056
Grilled Garlic Bread,https://www.edamam.com/web-img/f9f/f9fce8bcfaaaa11e80f3991eb8e8edb1.jpg,"Eight 3/4- to 1-inch-thick slices crusty, artisan-style bread, like ciabatta|Sea salt or kosher salt|1 to 2 large cloves garlic, peeled and halved|1/4 cup extra-virgin olive oil for brushing",928.266875,17.9546875,160.3099375,28.219625000000004
Blue Cheese Gnocchi,https://www.edamam.com/web-img/239/2390dac115144f8d0361940864551dfd.jpg,"100 ml/3½ fl oz crème fraîche , half-fat if preferred|250.0g bag baby spinach|100.0g soft blue cheese|4.0 tbsp grated parmesan|500.0g fresh gnocchi",563.8933446701899,18.63649867535154,72.40453669766914,26.834315188949706
Gnocchi with Kale,https://www.edamam.com/web-img/059/059ca3a92e0d2619e48772ba8716cf52.jpg,"1 teaspoon plus 2 teaspoons extra-virgin olive oil|1 large bunch kale, tough stems removed, thinly sliced crosswise|1 tablespoon finely grated lemon zest|1/2 batch Simple Potato Gnocchi, boiled|Coarse salt and ground pepper",145.9222086722333,4.422726115769923,23.18541379314489,5.308150836195283
Pesto Gnocchi with Shrimp and Broccoli,https://www.edamam.com/web-img/dbd/dbdd1c96cd0cd85e7651bff15790a1a3.jpg,"1 pound gnocchi, i like de cecco potato gnocchi|1½ pounds extra large (21 – 25 per pound) shrimp, peeled and deveined|3 cups broccoli florets|2 – 3 tablespoons pesto, i like de cecco pesto alla genovese|Parmesan cheese, for serving",338.57088688738423,6.142045755329716,39.640522964030964,30.392067212472632
Stilton & pear gnocchi,https://www.edamam.com/web-img/6e2/6e21db8789fa6914f542fad9ec07eee3.jpg,1 clove of garlic|1 large pear|a few sprigs of fresh flat-leaf parsley|1 knob of unsalted butter|2 tablespoons crème fraîche|50 g stilton|400 g gnocchi,1027.049,24.657269999999997,168.37877,32.36475
Pan-Fried Potato Gnocchi with Ramps,https://www.edamam.com/web-img/f18/f187061bb3db43faa9cdf65975445253.JPG,1 pound potato gnocchi|2 tablespoons butter|1 tablespoon olive oil|20 ramp leaves|Flaky sea salt,544.5936794463978,20.342606049482466,79.95184968820519,13.113193257195267
Greek Salad,https://www.edamam.com/web-img/8ad/8adc3b0dec518a864a28b1242c38a2b4.jpg,"16 Kalamata olives|85.0g feta cheese , cut into chunks (barrel matured feta is the best)|4.0 tbsp Greek extra virgin olive oil|1.0 tsp dried oregano|1 cucumber , peeled, deseeded, then roughly chopped|4 large vine tomatoes , cut into irregular wedges|½ a red onion , thinly sliced",230.5,19.74414,10.818354999999999,4.893045
"Easy Grilled Cornish Hens and Zucchini With Greek Marinade, Tzatziki, and Greek Salad Recipe",https://www.edamam.com/web-img/1b6/1b6b4b26c3518b0163e70d27dc4c9b3c.jpg,"For the Tzatziki:|1 large cucumber, peeled, seeds removed, grated on the large holes of a box grater (about 3/4 cup)|1 pint (2 cups) Greek-style yogurt|2 tablespoons juice from 1 lemon|2 tablespoons chopped fresh mint leaves|1/2 cup extra virgin olive oil|Kosher salt and freshly ground black pepper|2 Cornish hens, about 1 pound each|1 tablespoon kosher salt|1 teaspoon freshly ground black pepper|2 tablespoons fresh oregano leaves, roughly chopped|1 tablespoon juice and 2 teaspoons zest from 1 lemon|3 medium cloves garlic, finely minced|2 tablespoons extra-virgin oliveo oil|2 medium or 1 large zucchini, split in half lengthwise|2 to 3 pocketless Greek-style pitas|1 recipe Easy Chopped Greek Salad",1108.961787672153,83.45351960811375,42.695323718245135,53.386062868260666
Greek salad,https://www.edamam.com/web-img/40d/40d3659e5136b760e823274b363fbd30.jpg,"50g/2oz black kalamata olives|3 medium tomatoes, diced into 2cm/¾in cubes|1 cucumber peeled, diced into 2cm/¾in cubes|1 red pepper, de-seeded, diced|½ red onion, sliced finely|100ml/3fl oz extra virgin olive oil|150g/5oz feta, diced|1 small, firm cos lettuce, chopped into rough cubes lengthways|1 generous sprig of oregano (or 2 tbsp dried oregano)|50ml/3 tbsp red wine vinegar",360.78744012856384,32.53576532374402,12.273375,7.264616666666667
Greek Salad,https://www.edamam.com/web-img/e97/e974d4529f9e7b3daeead642febb1261.jpg,"3/4 pound tomatoes, seeded, diced (about 2 cups)|2 cups diced seeded peeled cucumber (from about 1 large)|1 cup diced red bell pepper (from about 1 large)|1/4 cup pitted kalamata olives or other brine-cured black olives, halved|1/4 cup diced red onion|3 tablespoons chopped fresh Italian parsley|3 tablespoons extra-virgin olive oil|1 1/2 tablespoons red wine vinegar|1/2 teaspoon dried oregano|1/4 cup crumbled feta cheese (about 2 ounces)",174.72774552500002,14.2982042605,9.29671399790625,3.6477386180312505
Greek Salad,https://www.edamam.com/web-img/0db/0db4479b951e810b3c09cf792ae11339.jpg,"8 to 10 large leaves from a heart of romaine lettuce|1 large ripe tomato (about 9 oz.), cut into chunks|Kosher salt and freshly ground black pepper|1/4 tsp. dried oregano, crushed|3 oz. black olives, such as kalamata (about 1/2 cup)|5 oz. feta cheese, cut into 3/4- to 1-inch cubes|2 Tbs. extra-virgin olive oil|1/4 medium red onion, thinly sliced|2 tsp. red-wine vinegar|2 tsp. fresh lemon juice|1/2 cucumber, peeled and cut into large dice|16 to 20 large mint leaves (from about 4 sprigs)",390.3461109427483,32.28260339292577,15.733701652565161,12.604215802912837
Grilled Cheese Sandwich,https://www.edamam.com/web-img/139/1390b1a3f79c6ab21220041042e0b91a.jpg,"2 thick slices sandwich bread|2 tablespoons salted butter|3 ounces cheese that melts well, like American, cheddar, pepper jack or havarti|something to add a little substance and soak up the smoky flavor, like turkey, grilled veggies, caramelized onions or roasted red peppers",7856.645191662501,335.790666162625,35.885185972687495,1109.3374760777501
Grilled Cheese Sandwich,https://www.edamam.com/web-img/c02/c0231d348c9e027b34fee0e57a8cb9e6.jpg,"2 tablespoons butter, room temperature|4 slices white sandwich bread or other bread|4 ounces grated (1 cup) or thinly sliced cheddar, swiss, or monterey jack cheese",468.1614425125,30.5652912045,28.628473514499998,20.218226522000002
Frico Grilled Cheese Sandwich,https://www.edamam.com/web-img/423/423db0d00251e50d1695c89f54f15add.jpg,"2 slices bread of your choice|2 teaspoons butter, salted or unsalted|1/2 cup (2 ounces) coarsely grated cheddar",113.21859444460992,7.181617902201446,7.248543078781322,4.982111637959353
The Ultimate Grilled Cheese Sandwich,https://www.edamam.com/web-img/179/1796d291c9fad4f3f10144612e2e1777.jpg,"4 tbsp. unsalted butter, softened|4 1⁄2""-thick slices sourdough bread|1 8-oz. piece comté cheese, grated",1420.18425555,68.1140748835,145.75163463025,57.387301437000005
Veggie Grilled Cheese Sandwich,https://www.edamam.com/web-img/bca/bca63a18562a9c4a33f638a27b44095f.jpg,"1 tablespoon extra-virgin olive oil|3 cremini mushrooms, sliced|1/4 yellow or red onion, chopped (about 70 grams or 2 1/2 ounces)|1/4 teaspoon minced garlic|1/2 scallion (white and green parts), chopped|Sea salt and freshly ground black pepper|Unsalted butter, for the bread, at room temperature|2 slices sourdough bread|2 1/2 slices mild Cheddar cheese (about 70 grams)|1 1/2 teaspoons Sriracha sauce|2 slices tomato (optional)|3 small leaves fresh basil (optional)|1/2 small avocado, peeled, pitted, and sliced",226.582448125,10.1404432875,26.326598589583337,8.317317322916667
Grilled Salmon Orzo Salad,https://www.edamam.com/web-img/874/8744b4b0aac93362738923cc53f09581.jpg,"8 ounces grilled salmon|16 ounces package of orzo pasta, prepared according to package directions|1 small bottle of capers (3.5 oz)|1 large shallot bulb, chopped|20 cherry tomatoes, halved|Juice of 2 large lemons|1/4 cup diced red bell pepper|2 tablespoons fresh dill, chopped|1 tablespoon fresh cracked pepper|Kosher salt, to taste",240.17808439561236,4.112695256844636,39.760872453858454,11.936262337441093
Cedar Plank–Grilled Salmon,https://www.edamam.com/web-img/a42/a42e13cd4766e05825b0d39381fc3568.jpg,"2 tablespoons olive oil, plus more for the plank|Four 6- to 8-ounce skin-on salmon fillets (or substitute arctic char|2 tablespoons prepared wasabi (that is wasabi paste from a jar or a tube)|2 tablespoons sugar|1 tablespoon soy sauce|1 tablespoon freshly grated ginger root|Salt",915.4654999999999,59.95276499999999,7.715859999999999,81.4105
Grilled Salmon,https://www.edamam.com/web-img/b39/b395cf0dfe7d320ddee0f267d9a25878.jpg,2 pound Filet of fresh salmon|2 x Lemons|2 cups Dill sprigs|2 x Salt,321.37304320000004,20.381925351333336,2.010126666666667,31.189833984666677
Grilled Salmon Collars,https://www.edamam.com/web-img/2e2/2e2ab212eb3260afba88b3fa1a873b3d.jpg,"1 2-inch piece ginger, peeled, thinly sliced|1 fresh red chile (such as Fresno or Holland), coarsely chopped|2 garlic cloves, smashed|1/2 cup mirin (sweet Japanese rice wine)|1/2 cup soy sauce|1/4 cup sake|1/2 teaspoon sugar|4 salmon collars (about 3 pounds total), scaled, fins removed|Kosher salt|Vegetable oil (for grill)",979.9194552,60.2916675,8.4313575,84.25485
Grilled Salmon recipes,https://www.edamam.com/web-img/1a8/1a8598ffc9fdf49a837d7bb69e9fca58,1/3 cup maple syrup|3 tablespoons whole-grain mustard|1 teaspoon cider vinegar|1/2 teaspoon finely chopped fresh thyme leaves|1/8 teaspoon kosher salt|1/8 teaspoon freshly ground black pepper|4 (6-ounce) skin-on salmon fillets|vegetable oil|kosher salt|freshly ground black pepper,456.06834928287896,26.087737648175068,18.73720806284033,35.243312054453064
Feta Tacos With Guacamole,https://www.edamam.com/web-img/55e/55efbbc01fd60b70e69b895d7fa6a657.jpg,"2 x 215g cans refried beans|2.0 tbsp olive oil|100 g bag iceberg lettuce|8 small flour tortillas|8 black olives , optional|2 x 130g tubs ready-made fresh guacamole|1 small packet fresh coriander|10 cherry tomatoes|1.0 tsp cumin seeds|2 medium red onions , cut into thin wedges|200.0g packet feta cheese",540.951,25.4043575,60.3979625,19.60095
guacamole,https://www.edamam.com/web-img/b38/b38e60c906a997cfea0a44d656aaec61.jpg,"2 tablespoons minced white onion (from about 1/8 large one)|1 1/2 tablespoons minced, seeded jalapeño (from about half a medium one)|2 tablespoons cilantro leaves, minced, plus more to taste|Juice of half a lime|1/4 teaspoon coarse or kosher salt, plus more to taste|2 medium-large ripe avocados",166.26921874998968,14.770654687499869,10.114534374997683,2.1747703124996756
Guacamole,https://www.edamam.com/web-img/d22/d226880d7f659b867617d71a29cc5f53.jpg,"1 medium garlic clove|1/2 teaspoon salt, or more to taste|4 ripe avocados, room-temperature|1/2 medium white onion, minced|a squeeze of fresh lime juice|to serve: chopped cilantro, chives or chive blossoms (optional)",1323.8700000000001,117.96720000000002,78.41480000000001,17.0606
Guacamole,https://www.edamam.com/web-img/f1f/f1fe415395c324677d772e36b0cb5cae.jpg,"2 cloves garlic, halved, germs removed|kosher salt (a solid three fingers full), and more to taste|1 shallot, minced|Juice from 1 to 2 limes|3 avocados|1 roma tomato, seeded and tiny diced|1/4 cup cilantro, roughly chopped",176.4216666666667,14.805785185185185,12.750244444444442,2.5422796296296295
Guacamole,https://www.edamam.com/web-img/1e4/1e4a97f58864228d0d11f18391c47df7.jpg,"2 cloves garlic, peeled|1 teaspoon kosher or sea salt|3 medium ripe avocados (about 1 1/2 pounds, 700 g)|Juice of one small lime|One small chili, chopped (you can keep or remove the seeds, which add more heat)|1/2 small red onion, peeled and finely diced|Optional: 1 scant teaspoon olive oil|Optional: a dash of chipotle or ancho chile powder",254.07875000000004,22.178449999999998,16.23955625,3.45236875
Vegan Gyoza,https://www.edamam.com/web-img/ac6/ac64aac126edb9df9a0b7af1c3375c95.jpg,"1 pacakge firm tofu frozen, thawed, washed|1/2 cup quinoa|200 grams cabbage (7 ounces)|4 scallions minced|2 large cloves garlic grated|1 inch knob ginger (about 1 tablespoon)|2 tablespoons sesame oil|1 tablespoons soy sauce|1 tablespoon sake|1 tablespoon potato starch|1 teaspoon salt|1/4 teaspoon white pepper|2 dried shiitake mushrooms|40 gyoza wrappers (a.k.a. potsticker wrappers)|vegetable for frying|2 tablespoons soy sauce|2 tablespoons rice vinegar|chili oil (optional)",352.87347610485034,5.75581047584821,60.43018759918673,14.121816233714176
Mushi-Gyoza (Steamed Gyoza),https://www.edamam.com/web-img/117/117e810646e05344ae85fac007a5c8ae.jpg,"1 pound ground pork|1 cup dried shitake mushrooms, rehydrated and chopped fine|1 tablespoon green onion, chopped fine|1 tablespoon ginger, grated|2 cloves garlic, crushed|2 teaspoons corn starch|1 teaspoon salt|1 teaspoon sugar|1 tablespoon mirin|1 tablespoon soy sauce|3 tablespoons canola oil|1 tablespoon sesame oil|50 round gyoza wrappers|3/4 cups soy sauce|1/3 cup vinegar|2 Thai chili peppers, chopped with seeds",258.55886942500007,13.308829016916667,22.28666319444444,11.373880171333333
Gyoza (Japanese Dumplings),https://www.edamam.com/web-img/cbd/cbde2d7d7a230372c75dca6f3f7c3ff1.jpg,"1 packet 50 gyoza wrappers|1/8 cabbage|1 teaspoon salt|400 g lean pork or chicken|1/2 bunch garlic chives, finely chopped|4 dried shiitake mushrooms, soaked in hot water and finely chopped|1 tablespoon grated ginger|2 teaspoons soy sauce|2 teaspoons sesame oil, plus 2 teaspoons extra, for cooking|Pinch of salt|2 tablespoons soy sauce|2 tablespoons rice vinegar|La-yu (Japanese chilli oil), optional",42.248695,0.9567211,5.4758666,2.696011200000001
Gyoza recipes,https://www.edamam.com/web-img/82e/82e10f46fe31bd8354dd792ae55c2d49,"1 pound ground pork|1/4 cup thinly sliced scallion|1 tablespoon low-sodium soy sauce|1 tablespoon sesame oil|2 teaspoons minced fresh ginger|1 teaspoon salt|1/2 teaspoon sugar|1/4 cup thawed and chopped frozen spinach, squeezed dry|36 round gyoza / won ton wrappers|2 tablespoons vegetable oil|1/2 cup water",57.80756983571429,3.3853707905476194,4.106271666666666,2.543340287047619
Shiso Gyoza,https://www.edamam.com/web-img/d27/d27724eebefd7c472e4a2a18e6f5b53d.jpg,200 grams cabbage (1/4 small head)|200 grams pork – ground|30 grams scallions minced|30 grams garlic chives - flat minced|15 grams ginger - fresh grated (about 1/2 inch length)|1 tablespoon potato starch|1 tablespoons toasted sesame oil|1 tablespoons soy sauce|1 tablespoon sake|1/2 teaspoon salt|1/4 teaspoon white pepper – ground|40 gyoza wrappers (a.k.a. potsticker wrappers)|40 shiso leaves - green stems trimmed|vegetable oil for frying|2 tablespoons soy sauce|2 tablespoons rice vinegar|chili oil optional,243.64961749996624,15.656870499998567,21.006814499996604,5.190773749999961
Classic Hamburger,https://www.edamam.com/web-img/e3c/e3cf26d5d877e762f3a85a43fef329db.jpg,"1 lb. ground beef or chuck|Salt and freshly ground black pepper|4 soft white hamburger bun, split|4 1/4""-thick slices of a large ripe tomato|12–16 sliced pickles (optional)|4 small leaves iceberg lattuce|4 1/4""-thick slices peeled onion",210.7523570432625,12.187570211723253,12.439736457730625,12.126825901341126
Cheddar And Blue Hamburger,https://www.edamam.com/web-img/e88/e8808d5d35b2e62a2a10414bac64613a.jpg,"4 tablespoons butter|2 fresh baked hamburger buns, soft|4 slices, Polish Ham|18 ounces freshly ground beef, 15/85 combo, measured out in 3 oz. balls|1 small onion, finely chopped|1 glove garlic, finely chopped|2 teaspoons season salt|2 teaspoons worcestershire sauce|pepper, freshly ground|4 ounces sharp cheddar, I like white cheddar fr/Vermont|2 ounces blue cheese, Maytag is my fav.|1 perfectly ripe tomato, sliced|yellow mustard",241.18816409600947,18.058706981873698,6.170793311533032,13.23168126200617
Hamburger Buns,https://www.edamam.com/web-img/64d/64d5db892b992842e9bca0f862c8b9d9.jpg,4 cup all purpose flour|1 cup whole wheat flour|1/3 cup toasted wheat germ|4 1/2 tsp active dry yeast|2 tsp salt|2 cup milk|1/4 cup sugar|1/4 cup butter,281.0081250002642,6.105977083336309,48.62780416671563,8.123631250009648
Hamburger Recipe,https://www.edamam.com/web-img/ad4/ad4eb01e42f452ffaf816dda604543b7.jpg,24 ounces ground beef (680 grams)|4 slices American cheese|1/2 cup mayonnaise|1/4 cup ketchup|2 teaspoons yellow mustard|1/2 dill pickle|hot sauce (to taste)|black pepper|1 small red onion sliced into rings|2 ripe tomatoes|4 leaves lettuce,739.951135,61.6769501,10.96925825,34.51163015000001
