name,image,ingredients,calories,fat,carbs,protein
Peking Duck,https://www.edamam.com/web-img/911/9110f9aa5cdebb0fc6ddad0e7ef4e296.jpg,"1 duck (4½ to 5 pounds), thawed if frozen|Salt and freshly ground black pepper|1 teaspoon Chinese five-spice powder|1 clove garlic, peeled|1 scallion, both white and green parts, trimmed|3 thin slices peeled fresh ginger|1 tablespoon Asian (dark) sesame oil|1 cup hoisin sauce|¼ cup honey|¼ cup soy sauce|¼ cup rice wine or sake|3 cloves garlic, minced|1 tablespoon minced peeled fresh gingerFor serving:|16 Scallion Crêpes, or Peking pancakes (see Notes) or flour tortillas|16 scallion brushes (see Notes)",349.4069695685547,24.76570732214253,21.66867845788143,9.357284939422048
Peking Duck Stir-Fried With Ginger And Green Onion,https://www.edamam.com/web-img/0e9/0e91f13b940d2fdafdc8869d9bc5b082.jpg,"This easy but elegant stir-fry is meant to save the cook time and let the duck shine. a 4-lb duck yields about 10 ozs of cooked flesh, so you'll have a little extra to tuck into your pancakes. serve this stir-fry with rice or wrap in extra mandarin|1 1/2 cups (about 1/2 lb) roast peking duck meat|2 tbsps plum sauce|1 tbsp shaoxing rice wine or dry sherry|1 tbsp light (regular) soy sauce|2 large whole green onions, cut on a steep bias into 2-inch-long pieces, each about 1/4 inch thick|2 tbsps canola oil|Chubby 3/4-inch section fresh ginger, peeled and cut into slivers or fine julienne|1 rib celery, cut on the bias to match green onions but half as thick|1/2 carrot, halved lengthwise and cut to resemble celery but slightly thinner|1 heaping cup bean sprouts|Salt",382.6731221981778,7.042474475555556,69.51998758888891,10.258363886666666
Andrea Nyguen's Pho Fried Rice recipes,https://www.edamam.com/web-img/095/09569f587eb72368c2d3a9c9b1c3e6d8,"3 cups day-old cooked rice (about 15 ounces)|2 tablespoons pho fat, European-style butter, or canola or other neutral oil, divided|2 tablespoons pho fat, European-style butter, or canola or other neutral oil, divided|1 clove garlic, finely chopped|1/2 medium red or yellow onion, cut along the grain into narrow wedges|1 large egg, beaten|2 teaspoons fish sauce or regular soy sauce, plus more as needed|1 teaspoon Maggi Seasoning sauce or Bragg Liquid Aminos|1/2 teaspoon Pho Spice Blend (below) or 1/4 teaspoon freshly ground black pepper|1/2 teaspoon Pho Spice Blend (below) or 1/4 teaspoon freshly ground black pepper|1 medium scallion, white and green parts, chopped|fine sea salt|2 or 3 sprigs fresh Thai basil or mint|2 star anise, about 3 grams total|1 medium Chinese black cardamom (optional)|2 whole cloves|1/2 teaspoon fennel seed|1 teaspoon coriander seed|10 black peppercorns|1/4 teaspoon ground cinnamon",299.558800234446,15.84080749281252,34.18936374117924,5.320889395244642
Traditional Beef Pho Recipe,https://www.edamam.com/web-img/e5d/e5d3b8674166e4507311f3ae1e6228b9.jpg,"2 large onions, split in half|1 large hand ginger (about 6 inches long), split in half lengthwise|3 pounds beef shin, with meat attached|2 pounds oxtail, cut into 1/2 to 1-inch thick slices|1 pound boneless beef chuck|1 pound beef brisket|3 whole star anise pods|1 cinnamon stick|1 teaspoon fennel seeds|4 cloves|1 teaspoon coriander seeds|1/4 cup fish sauce, plus more to taste|2 tablespoons sugar (preferably yellow rock sugar)|Kosher salt|To Serve:|6 to 8 servings pho noodles|1 pound beef flank steak, sliced thinly against the grain|2 to 3 cups mixed herbs (cilantro, basil, and mint)|2 to 3 cups trimmed bean sprouts|1/2 cup sliced scallions|Thinly sliced Thai chilis|2 limes, each cut into 4 wedges|Hoisin sauce and Sriracha",1606.0279149025555,56.812833091340046,151.71829881441593,121.71823429132779
Pho (Vietnamese Beef and Noodle Soup),https://www.edamam.com/web-img/839/839968d7c3fccaafb5d3f16a861e963f.jpg,"1 pound very lean sirloin of beef, trimmed of visible fat|1/4 pound chinese or vietnamese rice noodles, (banh pho)|3 cups homemade beef stock homemade beef stock|3 tablespoons asian fish sauce (nam pla)|1 1/3 cups fresh bean sprouts|1 small onion, peeled and very thinly sliced|4 scallions, trimmed and very thinly sliced|2 small thai chile pepper or 1 small jalapeno, very thinly sliced crosswise|1/3 cup fresh cilantro leaves or thai basil, coarsely chopped|Asian hot-chile sauce",201.33513406111115,3.93440094138889,20.35492245730556,21.35226533973611
"Rice noodles with Chinese chives, shrimp and pork (banh pho xao he)",https://www.edamam.com/web-img/d3d/d3d9c131e62cdb20a583f1d7aa2e8f80.jpg,"1/2 pound medium dried flat rice noodles (banh pho)|1 1/2 teaspoons sugar, divided|3 tablespoons fish sauce|3 tablespoons water|2 tablespoons canola or other neutral oil|3 cloves garlic, finely chopped|1/2 pound shrimp, peeled, deveined and chopped into pea-sized pieces|1/3 pound ground pork, coarsely chopped to loosen|1/4 teaspoon salt|1 pound chinese chives, bottom 1/2 inch trimmed and cut into 3-inch lengths|2 or 3 limes, quartered",937.3757133916667,33.64803273658333,116.26726725575003,44.59661748516666
Classic Chicken Pho (Phở Gà),https://www.edamam.com/web-img/75c/75c6884797d3dda3b284878cfede259d.jpg,"Chubby 4-inch (10 cm) section ginger, unpeeled|1 pound (450 g) yellow onion, unpeeled|3 pounds (1.35 kg) chicken parts, such as backs, necks, wings, feet, and drumsticks|1 (4-lb | 1.8-kg) whole chicken, rinsed and patted dry|5 quarts (5 l) water|2 tablespoons coriander seeds|4 whole cloves|1 small bunch (1 oz | 30 g) cilantro|1/2 ounce (15 g) Chinese yellow rock sugar|1 1/2 tablespoons fine sea salt|About 3 tablespoons fish sauce|1 1/4 pounds (565 g) dried narrow flat rice noodles, or 2 pounds (900 g) fresh pho noodles|Cooked chicken from the broth, cut or torn into bite-size pieces about 1/4-inch (6-mm) thick|1/2 medium (3 oz | 90 g) yellow or red onion, thinly sliced against the grain and soaked in water for 10 minutes|3 or 4 thinly sliced green onions, green parts only|1/2 cup (.35 oz | 10 g) chopped fresh cilantro, leafy tops only|Pepper (optional)|Optional extras: Garnish Plate for 8, Ginger Dipping Sauce",624.0741204213131,22.59581546519144,67.02886931630078,34.70377449572633
Breakfast Pizza,https://www.edamam.com/web-img/2cc/2cc78c72b75b0c31f6f2bbe6060acf24.jpg,"12 slices thick-cut, applewood-smoked bacon|1 batch Pizza Dough|1/2 cup crème fraîche|1 cup Caramelized Onions|8 large eggs|2 cups shredded part-skim mozzarella cheese",259.53714285714284,18.68517142857143,10.359771428571431,11.906000000000002
Pizza Dough,https://www.edamam.com/web-img/284/2849b3eb3b46aa0e682572d48f86d487.jpg,"500 g bread flour(3 3/4 cups)|2 1/2 tsp Dry Yeast instant or active (10 grams)|3/4 tsp Table Salt(5 grams)|3/4 tsp Sugar, plus a pinch (about 3 grams)|1 1/2 cup water at room temperature|extra-virgin olive oil for pans|2 x yellow onions(medium), finely chopped (pizza cipolla)|1/3 cup Heavy Cream(pizza cipolla)|1 tsp Kosher Salt(pizza cipolla)|2 tsp fresh thyme, coarsely chopped(pizza cipolla)|7 oz diced tomatoes, drained(pizza pomodoro)|3/4 cup Canned Tomatoes (reserved juice) (pizza pomodoro)|2 tsp Extra Virgin Olive Oil(pizza pomodoro)|1/2 tsp Kosher Salt(pizza pomodoro)|1 pinch Red Pepper Flakes(pizza pomodoro)|8 x fresh basil (large leaves), chopped(pizza pomodoro)",655.5767634609928,17.734726980714797,105.56144479176564,18.27822924053646
Pizza Frizza,https://www.edamam.com/web-img/9a8/9a87dd2cd93448b915b0199a2e2c646e.jpg,1 basic pizza dough|Sugar|Oil,163.969848,2.7702,29.183863200000005,5.016000000000001
Shaved Asparagus Pizza recipes,https://www.edamam.com/web-img/69b/69b8d995e081e796213efba80596e8ce,"1 recipe Really Simple Pizza Dough or your favorite pizza dough|1/2 pound asparagus|1/4 cup grated Parmesan|1/2 pound mozzarella, shredded or cut into small cubes|2 teaspoons olive oil|1/2 teaspoon coarse salt|black pepper|1 scallion, thinly sliced",386.06797524590024,18.834646230509005,32.79742784393006,21.48440011827601
"Chorizo, caper & rocket pizza",https://www.edamam.com/web-img/7fe/7fee72cbf470edc0089493eb663a7a09.jpg,"1 pack pizza base mix|3 tbsp tomato pizza sauce|2 small cooking chorizo, diced|1 tbsp capers, drained|handful cherry tomatoes, halved|handful rocket|olive oil, to drizzle",625.0975511997365,30.278472499989977,60.98016374996541,25.333754999991296
Parmesan Pork Chop,https://www.edamam.com/web-img/b14/b140daf0b4d0b3f111750c46f1f07501.jpg,5 ounce boneless pork chop|2 tablespoons progresso parmesan bread crumbs|1 tablespoon sunflower oil|1 cup steamed zucchini slices,106.65126048416366,6.638594095387456,3.2140999999619595,8.437335293585296
Sauteed Pork Chop with Wilted Kale recipes,https://www.edamam.com/web-img/187/18703cad1b5ae25cc4d4ce99a8191a5e,"4 teaspoons olive oil|1 garlic clove, thinly sliced|1 small bunch kale (about 7 ounces), leaves torn into bite-size pieces|coarse salt|ground pepper|1/4 teaspoon dried sage|1 bone-in rib pork chop (6 to 8 ounces)|1 tablespoon fresh lemon juice, plus a wedge for serving",601.8874939840875,37.84348710481275,19.26422449317688,49.931535199075384
Sauteed Pork Chop With Sage-Cider Cream Sauce,https://www.edamam.com/web-img/6d8/6d886fff13c946646c0907195c6c34d5.jpg,1 (1-inch-thick) rib pork chop|1 tablespoon extra-virgin olive oil|1/3 cup finely chopped onion|2 tablespoons cider vinegar|1/2 cup water|1/4 cup heavy cream|1 teaspoon finely chopped fresh sage|1 1/2 teaspoons finely chopped fresh parsley|Special equipment: an instant-read thermometer,699.5813333339356,53.89284583335708,8.656677500115542,43.358470833355334
Dinner Tonight: Pork Chop With Modern Soubise,https://www.edamam.com/web-img/5db/5dbc2ee3ad396131254a3c32150b4431.jpg,"For the stewed-onion purée:|1 pound onions, peeled and sliced|1 ounce butter|2 tablespoons heavy cream|1 tablespoon tomato paste|For the pork chops:|2 pork chops|1 1/2 tablespoons Canola oil|1/4 cup red wine|Salt and pepper",709.5719731307406,45.83031359691757,24.822445171917654,44.657404927324784
Pan-Roasted Brined Pork Chop recipes,https://www.edamam.com/web-img/dc5/dc5c140c2382edaec074c8da07bc0dab,"kosher salt|sugar|juniper berries|black peppercorns|head of garlic, halved crosswise, plus 2 unpeeled cloves for basting|large sprigs thyme|2-inch-thick bone-in pork chop (2 ribs; about 1 1/4 lb.)|vegetable oil|unsalted butter|coarse sea salt",605.8668530770125,33.454399655600746,13.145496935185125,60.54775268668812
Quick and Easy Poutine Recipe,https://www.edamam.com/web-img/21c/21cf4208db7ee3684fb60b6bee41f856.jpg,"1/4 cup unsalted butter|1/4 cup all-purpose flour|2 cups store-bought beef stock|1 cup store-bought or homemade chicken stock|2 teaspoons Asian fish sauce|2 teaspoons soy sauce|1 1/2 tablespoons rice vinegar|Kosher salt|1 freshly made batch homemade French fries from the Perfect Poutine recipe or about 2 pounds frozen thick-cut French fries, reheated following package instructions|12 ounces white cheddar cheese curds or mild white cheddar cheese, at room temperature and torn into bite-size pieces",344.079544441714,27.460583275083348,7.267638148463258,17.07787405184018
Vegetarian Poutine,https://www.edamam.com/web-img/b66/b663877afdef9bfabf143346a31560b9.jpg,4 small or 2 large Russet potatoes|3 tablespoons olive oil|2 tablespoons butter|2 tablespoons all-purpose flour|1 cup vegetable stock|1/2 pound cheese curds,502.2297501420825,18.676665789063065,71.66037708637928,14.681973180853475
Sweet Potato Poutine,https://www.edamam.com/web-img/fa6/fa65381026acd43e144db4db848cf52a.jpg,2 large yams|2 Tbs canola oil|1/4 lbs cheese curds|2 Tbs butter|1 small shallot minced|1 Tbs flour|1/2 C chicken stock|1 Tbs port|1 tsp demi-glace|1/4 tsp chopped fresh thyme,178.43160510818666,9.670630079583118,18.910404879394175,3.8044098559976423
Pretzel Poutine Recipe,https://www.edamam.com/web-img/1c6/1c64e41b5e766dd08a0dd91215382151.jpg,"3 tablespoons unsalted butter|3 tablespoons all purpose flour|1 onion, minced|1 clove garlic, minced|1 teaspoon fresh rosemary, minced|1 cup smoked beer or other beer of your choice|1 cup chicken or vegetable stock|1 teaspoon sugar|4 pretzel sausage buns, cut into thick ""fries""|1 cup fresh cheese curds (or substitute chunks of cheddar or queso fresco if you can't find curds)|kosher salt and black pepper, to taste",336.60508374999995,13.484899275,36.4271489375,13.361053287499999
Kimchi Poutine,https://www.edamam.com/web-img/7fa/7fa148212b402d5d5e48b8cf0c620141.jpg,1 tablespoon unsalted butter|1 tablespoon all-purpose flour|¾ cup heavy cream|¼ cup chicken stock|1 teaspoon soy sauce|Pinch of cayenne pepper|Salt and freshly ground black pepper to taste|As many french fries as will fit in a 6-inch cast-iron skillet in a single layer|½ cup cheese curds (see note)|¼ cup chopped kimchi|1 teaspoon chopped fresh flat-leaf parsley,448.48238750001167,41.696345750000255,10.191911875002067,9.930207375000952
Perfect Prime Rib Recipe,https://www.edamam.com/web-img/b95/b953067168fb63cd74bdae82f194eacb.jpg,"1 standing rib roast (prime rib), 3-12 pounds (see note above)|Kosher salt|Freshly ground black pepper",913.7944312500001,79.104502125,0.5431753125,46.35087506250001
Prime Rib,https://www.edamam.com/web-img/45a/45abbfc2f8c2e11be58e3ece124515b1.jpg,"1 whole Rib Eye Roast (I Use Boneless, But You Can Do More Traditional Bone-in Prime Rib) About 14 Pounds|4 Tablespoons Olive Oil|1/2 cup Kosher Salt|4 Tablespoons Tri-color Peppercorns (or Any Peppercorns)|3 sprigs Rosemary|3 sprigs Thyme|1/2 cup Minced Garlic",504.20133333333325,40.000663333333335,3.786375,33.232745
Prime Rib recipes,https://www.edamam.com/web-img/909/909d4f1afc62c7e01528b8b3501c32df,"1 (4-bone) prime rib roast (from the loin end), about 9 pounds once trimmed, ribs removed from roast in one cut to create a rib rack, excess fat removed and reserved|4 teaspoons kosher salt|ground black pepper|4 sprigs rosemary|4 garlic cloves, unpeeled and smashed",34.444040750000745,2.6519590950000094,0.841304087500189,1.818249017500031
"Dry Aged ""Prime"" Prime Rib",https://www.edamam.com/web-img/8e1/8e174aad3f39393e70b2a60dedc1ed58.jpg,"1 7 bone prime rib, dry aged|1 cup kosher salt|1/4 cup cracked black pepper|2 tablespoons olive oil|2 tablespoons chopped fresh thyme",1318.8306000000916,117.5510160000011,2.1317700000236406,58.89776400000343
Prime Rib Roast,https://www.edamam.com/web-img/83c/83c4d6d8cc51f912c3d6774fe04067ef.jpg,"15 dried bay leaves, crumbled|1/3 cup coarsely chopped fresh sage leaves, plus several whole leaves for garnish|1/2 cup extra-virgin olive oil|Coarse salt and freshly ground pepper|1/3 cup finely grated orange zest (from 2 to 3 oranges)|1 three-rib prime rib of beef (about 7 pounds), trimmed and frenched",1313.4059944004036,119.19408578343291,2.640584404131412,54.11767786143891
Pulled-Pork Sandwich,https://www.edamam.com/web-img/8ea/8eaa8458744d2d65169b08e43ce7c341.jpg,"1 cup spice and brown sugar-rubbed pork tenderloin|2 tablespoons prepared barbecue sauce|1 whole-wheat hamburger bun, split or 2 slices whole wheat bread",777.57,20.6207,33.0398,108.68929999999999
Pulled Pork Sandwich,https://www.edamam.com/web-img/402/4020782f1a07a0f70ea3ab108f7925cf.jpg,"1 large onion, chopped|6 garlic cloves, peeled|1 pickled jalapeño pepper, seeded and chopped|2 teaspoons of Chipotle chile powder|1 Tbsp tomato paste|2 Tbsp Dijon mustard|3/4 cup distilled white vinegar|1 teaspoon paprika|1/3 cup ketchup|2 teaspoons Worcestershire sauce|1/4 cup light brown sugar|1 bay leaf|Salt|3 lbs of pork butt shoulder roast, trimmed of excess fat|Hamburger buns",276.88038203755667,9.387021245375001,11.344018830472471,36.848141773375005
Pulled Pork Sandwich,https://www.edamam.com/web-img/549/54948d1c6f3658390ea38fbd77d24036.jpg,"1 boneless pork shoulder (about 4 to 41/2 pounds)|4 tablespoons kosher salt|1 tablespoon freshly ground black pepper|1 1/2 cups light brown sugar|1/4 cup paprika|2 to 3 sprigs thyme, leaves only|4 cloves garlic|1/4 cup red wine vinegar|Scant 1 tablespoon cayenne|3 tablespoons extra-virgin olive oil|1 tablespoon whole-grain mustard|1 cup mayonnaise|1/4 cup sour cream|1/2 lemon, juiced|2 tablespoons red wine vinegar|2 teaspoons sugar|1/2 head savoy cabbage finely sliced|1/2 head purple cabbage, finely sliced|2 green onions, chopped|2 carrots, sliced on mandoline|Kosher salt and freshly ground black pepper|6 brioche hamburger buns|1/4 bunch flat-leaf parsley, for garnish",2317.497681508226,166.02612621830556,74.41826299991921,126.93232442925613
Pulled Pork Sandwich,https://www.edamam.com/web-img/d34/d34e01660a1b1fa708833adb7846e70f.jpg,1 c. each bottled barbecue sauce and applesauce|1 tbsp. each Worcestershire sauce and brown sugar|2 tsp. oil|1 lb. pork tenderloin|2 c. Crispy Coleslaw or your favorite prepared or homemade coleslaw|8 reduced-calorie hot dog rolls,670.5070859998544,19.32585266525,88.54590156246243,33.20377485124995
Pulled Pork Sandwiches recipes,https://www.edamam.com/web-img/189/18959d670b68d621d529ec4472ef8b83,10 cups shredded pork shoulder|1/2 to 1 cup barbecue sauce (store-bought or homemade)|12 hamburger buns,6047.505,451.4418124999999,28.3506375,433.79197500000004
Smoked Ramen and Soft-Boiled Egg Soup,https://www.edamam.com/web-img/3c8/3c849c586417f77e493b303d8316faa1.jpg,2 eggs|1 packet instant ramen,74.25,4.59941,2.05714,5.69573
Chicken Ramen,https://www.edamam.com/web-img/15b/15b3c28a2df3910ec02e68b771de33a3.jpg,"2 pounds chicken bones|1 pound chicken wing tips|1 small leek cut into 4 pieces|2 length ginger sliced into 8 coins|4 large cloves garlic unpeeled|vegetable oil for frying the aromatics|4 inch piece kombu|10 cups water|1/4 cup sesame oil|3 scallions white part only, minced|1 tablespoon soy sauce|1 cup soy milk|1 tablespoon salt|4 servings ramen noodles boiled according to package directions",346.54545405333334,29.174611344000002,8.989779166666667,11.751853034666668
Waffle Iron Ramen Recipe,https://www.edamam.com/web-img/7ad/7ad0f60865ab1a5b8c0a3a5e1fe1c1ca.jpg,"1 large egg|1 teaspoon soy sauce, plus more for serving|1 tablespoon sesame seeds, plus more for serving|Toasted sesame oil|1 packet instant ramen noodles (about 100 grams), soaked in hot water for 3 minutes and drained|Nonstick cooking spray|1 tablespoon chopped green onions for garnish (optional)",603.3288848,30.838302312000003,63.454103911999994,18.482929648
Perfect Instant Ramen,https://www.edamam.com/web-img/d91/d91aeb2221c6ed93145cd8ecf4a925d4.jpg,"2 1/2 cups water|1 pack Shin Ramyun or whatever pack of instant ramen you have|1 egg|1/2 teaspoon butter|2 slices American cheese|1/4 teaspoon roasted sesame seeds|1/2 scallion, green part only, thinly sliced on a bias",598.1615625010778,31.618688541782838,55.75279375000899,22.5928239583411
Shrimp And Bacon Ramen Stir Fry,https://www.edamam.com/web-img/bac/bacc92ef38b9539d10409753e6791d30.jpg,"2 instant ramen packages, seasonings discarded|1 teaspoon (5ml) sesame seed oil|2 teaspoons (10ml) fish sauce|1 tablespoon (15ml) chili garlic sauce, or to taste|3 pieces bacon, cut into 1/2-inch pieces|1/2 medium onion, sliced|1/4 pound (113g) bay shrimp|1 egg|1/4 cup (60ml) chopped fresh herbs (thai basil, mint, cilantro, etc...)",308.4696919281118,22.626823741448863,8.790217015928466,17.435540520099092
Baked Ravioli Appetizers,https://www.edamam.com/web-img/574/574bd728503f88783327afd96c38010b.jpg,1 lb. frozen ravioli|1/2 stick butter cut into small patties|1/2 cup tomato sauce|1/2 cup grated romano cheese,208.24535759,9.6769778351,22.212286390000003,8.417321995
Baked Ravioli,https://www.edamam.com/web-img/a17/a174f91a39a2db4dedee56ec88dae365.jpg,"2 tablespoons olive oil|1 medium onion, chopped|3 cloves garlic, minced|Coarse salt and freshly ground pepper|1 1/2 teaspoons dried thyme, or oregano|1 can (28 ounces) whole tomatoes|1 can (28 ounces) crushed tomatoes|2 pounds store-bought frozen ravioli|1 1/2 cups shredded mozzarella|1/2 cup grated parmesan cheese",1053.3428576508877,37.37132371739325,134.2487865902869,50.50398097843988
Ravioli in Truffle Cream Sauce,https://www.edamam.com/web-img/294/294f568f9c1d2f74e1709d8e97899fa2.jpg,2 tablespoons butter|1/2 cup heavy cream|1 tablespoon salsa tartufata|1/4 cup freshly grated parmesan|8 ounces fresh ravioli,713.2011439749999,45.39508958775001,56.02529847500001,21.837479987500004
Ravioli With Herbed Walnut Sauce,https://www.edamam.com/web-img/fb4/fb4407378f616df3f900c242158e7ecf.jpg,"1 pound purchased cheese ravioli|1/4 cup (1/2 stick) butter|3/4 cup coarsely chopped walnuts|3 garlic cloves, minced|1 cup dry white wine|1/4 cup chopped fresh parsley|1 tablespoon chopped fresh rosemary",644.917018975,34.07738708775,58.851447225000015,19.0785099875
Florentine Ravioli,https://www.edamam.com/web-img/245/24563f2fb9e65c2d3a0900ce1edba214.jpg,"1 20-ounce package frozen cheese ravioli, or tortellini (4 cups)|4 cloves garlic, minced|1/4 cup freshly grated Parmesan cheese|1/4 teaspoon salt|1/8-1/4 teaspoon crushed red pepper|1 16-ounce bag frozen chopped or whole-leaf spinach|6 teaspoons extra-virgin olive oil, divided|1/2 cup water",449.73487377500004,16.85446787325,56.14334482025,20.548962633
Red Velvet Cake Bars,https://www.edamam.com/web-img/e00/e00820516518b58f58efe520e3074a57.jpg,"8 ounces red velvet cake (about 4-5 cupcakes, or any cake scraps you may have)|2 ounces butter|1 8oz packet cream cheese|½ cup heavy cream|¾ cup powdered sugar|½ tsp vanilla or extract of your choice",660.150369640625,44.01658225059376,63.7626026193125,6.53098790465625
Red Velvet Cake Balls,https://www.edamam.com/web-img/dcc/dcca9e1baf5ba6b19ebe67189eb14848.jpg,1   18 1/2 oz. pkg. red velvet cake mix|1   16-oz. container cream cheese frosting|1   16-oz. pkg. regular or white melting chocolate,125.44073367747399,4.852198067363282,21.350970849541667,0.8106191768554689
Red Velvet Cake,https://www.edamam.com/web-img/2d0/2d0554c0af98175809e742308fefd6bb.jpeg,1 pkg Duncan Hines® Red Velvet Cake Mix|1 1/4 cup water|1/3 cup vegetable oil|3 large eggs|1 tub Duncan Hines® Creamy Home-Style Cream Cheese Frosting|White chocolate (for garnish),230.13666666746377,10.434071428661598,31.06810476190476,3.2106190476190477
Montclair Martha's Red Velvet Cake,https://www.edamam.com/web-img/a0a/a0ac1e0d558ce3235f4a6fde63e7c97b.jpg,"3/4 cup unsalted butter, room temperature, plus more for pans|2 1/2 cups cake flour (not self-rising), sifted, plus more for pans|3 tablespoons unsweetened cocoa powder|1 1/2 teaspoons baking powder|2 cups sugar|3 large eggs|1 teaspoon pure vanilla extract|1/4 teaspoon salt|2 one-ounce bottles liquid red food coloring|3 tablespoons lukewarm water|1 cup buttermilk|1 teaspoon baking soda|1 tablespoon white vinegar|Cream cheese frosting for red velvet cake",547.0344375,19.959774375000002,86.45879500000001,7.458280625
red velvet cake,https://www.edamam.com/web-img/e59/e59946c3e4cffd9bc97c0d16d3d466f1.jpg,1 tablespoon unsalted butter|3 1/2 cups cake flour|1/2 cup unsweetened cocoa (not Dutch process)|1 1/2 teaspoons salt|2 cups canola oil|2 1/4 cups granulated sugar|3 large eggs|6 tablespoons (3 ounces) red food coloring or 1 teaspoon red gel food coloring dissolved in 6 tablespoons of water|1 1/2 teaspoons vanilla|1 1/4 cup buttermilk|2 teaspoons baking soda|2 1/2 teaspoons white vinegar.,358.5808181818182,21.568004545454546,39.34184977272727,3.493107045454546
Cook the Book: Strawberry Risotto,https://www.edamam.com/web-img/2b7/2b75097b28237aaa06fc6971f69e0cd3.jpg,"4 cups vegetable stock|6 tablespoons butter|1 onion, finely chopped|1 1/2 cups risotto rice|1 3/4 cups dry white wine|2 3/4 cups hulled strawberries|1 cup heavy cream|Salt and freshly ground white pepper",750.4502392683299,40.14581220125227,73.54650229251719,7.416351951413908
Asparagus Risotto,https://www.edamam.com/web-img/087/08759665532af7ad14e517c80d777cbe.jpg,25 g of grated parmesan|A glug of white wine or marsala|1 litre of good quality chicken or vegetable stock|25 g of unsalted butter|1 onion finely sliced|200 g risotto rice,1013.7207225899522,20.09652408633174,113.24202502062587,24.916700581296652
Basic Baked Risotto,https://www.edamam.com/web-img/4a9/4a997a87e8a5699ce3698ad18cc8ec16.jpg,1 ½ cup arborio (or risotto) rice|4 ½ cups chicken stock|1 cup finely grated parmesan|40 g unsalted butter|sea salt and cracked black pepper,272.880876875,9.554699237500001,34.59784646875001,10.970406043750002
Baked chicken & porcini risotto,https://www.edamam.com/web-img/39f/39f0eb157b83d138f03fe48735197657.jpg,25 g dried porcini mushrooms|4 x 125 g free-range chicken thigh fillets|1 clove of garlic|400 g Arborio risotto rice|1 litre of organic chicken stock|4 sprigs of fresh thyme|50 g unsalted butter|80 g Parmesan cheese,835.3453612949761,33.57778704316587,94.85458751031294,35.525350290648326
Asparagus risotto,https://www.edamam.com/web-img/c28/c284cc436c8d2177c43d83ebdfc3f59b.jpg,"1 tbsp olive oil|1 shallot, chopped|1 garlic clove, chopped|200g/7oz risotto rice (eg carnaroli or arborio)|250ml/9fl oz white wine|500ml/18fl oz hot vegetable stock|4 asparagus spears, blanched, chopped|25g/1oz unsalted butter|75g/2¾oz parmesan, grated|Salt and freshly ground black pepper|150g/5½oz parmesan, grated",1084.1928295672724,46.72530936950545,93.51051684816885,48.28065612016448
Samosa,https://www.edamam.com/web-img/d97/d9714c6f9641b447f3e7ff3aa8749b98.JPG,3 medium sized potatoes boiled and mashed|1/4 cup peas blanched|1 teaspoon cumin seeds|1 teaspoon fennel seeds|1.5 teaspoons ginger paste|1.5 teaspoons green chilli paste|1 teaspoon dry mango powder or lemon juice|1 teaspoon garam masala|Salt to taste|Handfuls fresh corriander leaves optional|Handful of cashews and raisins|1 cup ap flour|1/2 teaspoon ajwain seeds|Oil for deep frying and 2 tbsp for kneading the dough|1 tablespoon ghee|2 tablespoons rice flour,411.9891458330658,14.153134999999232,64.0401821874428,8.97279385416304
